{
  "version": "1.0",
  "source": {
    "artifacts": [
      "skills/deck-designer/examples/retail-agent-outline.json"
    ],
    "assumptions": [
      "这是基于 deck 结构和受众角色的预演,不是客户真实反馈。",
      "未提供具体参会人时,使用通用购买委员会角色建模。"
    ],
    "limitations": [
      "没有真实客户访谈或会议录音输入。",
      "评分用于改稿排序,不代表真实成交概率。"
    ]
  },
  "meeting": {
    "title": "连锁餐饮门店执行 AI agent 方案",
    "audience": "连锁餐饮 COO 和门店运营负责人",
    "objective": "让客户同意进入 2 周试点,验证一线入口 + 本地 agent 的门店执行闭环",
    "success_next_step": "客户确认试点门店、试点场景和数据素材清单",
    "meeting_type": "solution-pitch",
    "known_context": "售前客户提案"
  },
  "audience_panel": [
    {
      "id": "decision-owner",
      "role": "连锁餐饮 COO 和门店运营负责人中的业务决策者",
      "agenda": "判断这件事是否值得推进,以及下一步是否需要投入团队时间。",
      "success_criteria": [
        "业务问题被说清楚",
        "下一步范围和风险可控",
        "能看到可验证的价值路径"
      ],
      "likely_objections": [
        "这是否是现有工具的包装",
        "为什么现在必须做",
        "试点投入是否可控"
      ]
    },
    {
      "id": "internal-champion",
      "role": "内部推动者",
      "agenda": "寻找能带回组织内部继续推动的清晰话术、证据和试点抓手。",
      "success_criteria": [
        "有一句话主张",
        "有可复述的场景",
        "有明确试点清单"
      ],
      "likely_objections": [
        "哪些材料可以发给内部",
        "能否快速做一个小范围试点"
      ]
    },
    {
      "id": "frontline-owner",
      "role": "实际使用 / 运营负责人",
      "agenda": "确认方案是否真的减轻一线负担,而不是增加新系统和新流程。",
      "success_criteria": [
        "入口简单",
        "动作闭环清楚",
        "异常处理和责任边界清楚"
      ],
      "likely_objections": [
        "一线会不会不用",
        "日常操作是否更复杂",
        "谁来维护知识和流程"
      ]
    },
    {
      "id": "technical-evaluator",
      "role": "技术 / 实施评估者",
      "agenda": "判断集成、权限、数据安全和上线节奏是否可控。",
      "success_criteria": [
        "系统边界清楚",
        "数据来源清楚",
        "试点不依赖大规模改造"
      ],
      "likely_objections": [
        "要接哪些系统",
        "权限如何控制",
        "上线周期是否被低估"
      ]
    },
    {
      "id": "finance-procurement",
      "role": "财务 / 采购把关者",
      "agenda": "确认 ROI 口径、预算合理性和采购风险。",
      "success_criteria": [
        "指标口径明确",
        "预算前置风险低",
        "成功后扩展路径清楚"
      ],
      "likely_objections": [
        "价值如何量化",
        "试点后怎么决定买不买",
        "是否已有替代方案"
      ]
    }
  ],
  "deck_arc": {
    "summary": "先证明门店执行问题不是工具问题,而是动作、知识、数据断链;再展示一线入口 + agent 如何闭环;最后给出试点路径。",
    "strongest_moment": "agent-loop · 一线入口承接动作,agent 是把执行跑起来的工作引擎",
    "weakest_moment": "execution-gap · 门店执行的断点不在“有没有群”,而在动作能否闭环",
    "narrative_risk": "如果证据和下一步 ask 不够具体,客户会把会议结果降级为内部再评估。",
    "scores": {
      "clarity": 78,
      "urgency": 70,
      "trust": 58,
      "feasibility": 70,
      "next_step_readiness": 67
    }
  },
  "slide_reactions": [
    {
      "slide_key": "cover",
      "title": "门店执行 AI agent 方案",
      "reaction": "听众会快速判断这是不是为自己准备的场景,封面能建立主题但还不能形成信任。",
      "positive_signal": "如果客户名、行业场景和会议目标明确,内部推动者会更容易复述。",
      "friction": "封面若只像通用方案,决策者会把后续内容当成标准宣讲。 当前风险: 客户 logo 需确认是否已入库。",
      "likely_questions": [
        "哪些判断是已经验证的,哪些还只是推断?"
      ],
      "simulated_quote": "模拟听众: '这页我听懂了,但我需要知道哪些判断是已经验证的,哪些还只是推断。'",
      "revision_hint": "把 message 扩成可复述的一句话,说明这页为什么推动下一步。"
    },
    {
      "slide_key": "execution-gap",
      "title": "门店执行的断点不在“有没有群”,而在动作能否闭环",
      "reaction": "这一页决定听众是否认同问题定义。讲得准会提升紧迫感,讲得泛会被认为是供应商话术。",
      "positive_signal": "业务决策者和一线负责人会关注它是否命中当前卡点。",
      "friction": "缺少客户自己的例子或公开证据时,容易被追问'这是不是你们假设的'。 当前风险: 不能写具体损失数字。 这一页带有待补证据,讲述时要主动说明。",
      "likely_questions": [
        "这个痛点在我们这里有多严重,有没有当前数据或样例?",
        "哪些判断是已经验证的,哪些还只是推断?"
      ],
      "simulated_quote": "模拟听众: '这页我听懂了,但我需要知道这个痛点在我们这里有多严重,有没有当前数据或样例。'",
      "revision_hint": "保留核心信息,补一个客户可验证证据或把缺口改成会议问题。"
    },
    {
      "slide_key": "agent-loop",
      "title": "一线入口承接动作,agent 是把执行跑起来的工作引擎",
      "reaction": "这一页会把兴趣转成可行性判断。听众会从'听起来不错'转向问边界、集成和落地。",
      "positive_signal": "内部推动者能拿它解释方案全貌,技术评估者能看到系统边界。",
      "friction": "如果 demo 多于业务闭环,财务和技术角色会怀疑这是展示而不是落地方案。",
      "likely_questions": [
        "这套方案和我们现有系统怎么衔接,第一步要接什么?"
      ],
      "simulated_quote": "模拟听众: '这页我听懂了,但我需要知道这套方案和我们现有系统怎么衔接,第一步要接什么。'",
      "revision_hint": "保留核心信息,补一个客户可验证证据或把缺口改成会议问题。"
    },
    {
      "slide_key": "pilot-path",
      "title": "两周试点先跑一个闭环,再扩展到更多门店动作",
      "reaction": "这一页会把讨论从认知转向行动,关键是下一步是否低风险、可执行。",
      "positive_signal": "清晰的试点清单会让会议更容易收束到负责人和时间窗口。",
      "friction": "如果 ask 太大或指标不清,客户可能会选择内部再看看。 当前风险: 试点指标需客户确认。 这一页带有待补证据,讲述时要主动说明。",
      "likely_questions": [
        "下一步需要我们投入谁、多少时间、准备哪些材料?",
        "哪些判断是已经验证的,哪些还只是推断?"
      ],
      "simulated_quote": "模拟听众: '这页我听懂了,但我需要知道下一步需要我们投入谁、多少时间、准备哪些材料。'",
      "revision_hint": "保留核心信息,补一个客户可验证证据或把缺口改成会议问题。"
    },
    {
      "slide_key": "next-step",
      "title": "下一步:确认试点场景、素材和门店范围",
      "reaction": "这一页会把讨论从认知转向行动,关键是下一步是否低风险、可执行。",
      "positive_signal": "清晰的试点清单会让会议更容易收束到负责人和时间窗口。",
      "friction": "如果 ask 太大或指标不清,客户可能会选择内部再看看。",
      "likely_questions": [
        "下一步需要我们投入谁、多少时间、准备哪些材料?"
      ],
      "simulated_quote": "模拟听众: '这页我听懂了,但我需要知道下一步需要我们投入谁、多少时间、准备哪些材料。'",
      "revision_hint": "把 message 扩成可复述的一句话,说明这页为什么推动下一步。"
    }
  ],
  "objection_map": [
    {
      "persona_id": "decision-owner",
      "objection": "这件事是否真的足够重要,值得现在推进?",
      "trigger_slide_keys": [
        "execution-gap"
      ],
      "best_response": "用客户自己的业务时刻和一个可验证指标回答,不要只讲通用趋势。"
    },
    {
      "persona_id": "technical-evaluator",
      "objection": "集成、权限和数据边界是否被低估?",
      "trigger_slide_keys": [
        "agent-loop"
      ],
      "best_response": "把首期试点限定在最小系统边界,列出需要接入和暂不接入的系统。"
    },
    {
      "persona_id": "finance-procurement",
      "objection": "如何判断试点值得继续投入?",
      "trigger_slide_keys": [
        "next-step"
      ],
      "best_response": "提前给出试点成功指标、复盘口径和扩展条件。"
    }
  ],
  "outcome_forecast": {
    "primary_outcome": "internal-review",
    "confidence": "medium",
    "why": "整体叙事可推进,但还需要内部推动者把材料带回组织继续消化。",
    "conditions_to_improve": [
      "补一页客户当前流程或样例,让痛点从假设变成共同事实。",
      "把 closing ask 改成低风险试点清单:场景、负责人、素材、时间窗口。",
      "为技术/财务角色补充系统边界和指标口径。"
    ]
  },
  "revision_queue": [
    {
      "priority": "P0",
      "target": "execution-gap",
      "issue": "问题定义若缺少客户样例,会被认为是通用供应商话术。",
      "change": "补一个用户提供的流程、截图、SOP 或公开证据;没有证据时改成会议确认问题。",
      "owner": "evidence"
    },
    {
      "priority": "P0",
      "target": "next-step",
      "issue": "下一步 ask 需要更具体,否则会议容易停在内部评估。",
      "change": "写清试点场景、材料清单、负责人和时间窗口。",
      "owner": "deck"
    },
    {
      "priority": "P1",
      "target": "deck-level",
      "issue": "不同角色的关切没有被显式回应。",
      "change": "讲述时分别回应业务价值、实施边界、一线使用和 ROI 口径。",
      "owner": "talk-track"
    }
  ],
  "talk_track": {
    "opening": "先声明本次不是完整方案宣讲,而是把一个业务闭环缩小到可试点、可验证的下一步。",
    "transition_notes": [
      "从痛点页转方案页时,用'所以我们不从工具开始,从动作闭环开始'承接。",
      "进入 demo 或架构页前,先说明首期边界,降低技术评估者的风险感。",
      "收束时不要泛泛说期待合作,直接落到试点材料和负责人。"
    ],
    "closing_ask": "客户确认试点门店、试点场景和数据素材清单",
    "do_not_say": [
      "不要承诺未验证的提升百分比。",
      "不要把模拟反馈说成客户真实反馈。",
      "不要用'全面赋能'替代具体试点动作。"
    ]
  },
  "claim_discipline": {
    "simulated_not_observed": true,
    "needs_confirmation": [
      "试点周期、试点门店数、成功指标。"
    ],
    "unsafe_claims_to_remove": [
      "不能写具体节省时间、提升百分比或客户已验证效果。"
    ]
  }
}
